<?xml version="1.0" ?>
<!--
/**
 * Magento
 *
 * NOTICE OF LICENSE
 *
 * This source file is subject to the Open Software License (OSL 3.0)
 * that is bundled with this package in the file LICENSE.txt.
 * It is also available through the world-wide-web at this URL:
 * http://opensource.org/licenses/osl-3.0.php
 * If you did not receive a copy of the license and are unable to
 * obtain it through the world-wide-web, please send an email
 * to license@magentocommerce.com so we can send you a copy immediately.
 *
 * DISCLAIMER
 *
 * Do not edit or add to this file if you wish to upgrade Magento to newer
 * versions in the future. If you wish to customize Magento for your
 * needs please refer to http://www.magentocommerce.com for more information.
 *
 * @copyright   Copyright (c) 2014 X.commerce, Inc. (http://www.magentocommerce.com)
 * @license     http://opensource.org/licenses/osl-3.0.php  Open Software License (OSL 3.0)
 */

-->
<fixture class="Magento\Mtf\Test\Fixture\Test"
         xmlns:xsi="http://www.w3.org/2001/XMLSchema-instance"
         xsi:noNamespaceSchemaLocation="../../../../../../Mtf/Fixture/etc/fixture.xsd">
    <module>Magento_Mtf</module>
    <type>blank</type>
    <entity_type>test_fixture</entity_type>
    <fields>
        <field name="locator">
            <attribute_code>locator</attribute_code>
            <frontend_input>text</frontend_input>
            <frontend_label>Locator</frontend_label>
            <is_required>1</is_required>
            <default_value xsi:type="string">About</default_value>
        </field>
        <field name="strategy">
            <attribute_code>strategy</attribute_code>
            <frontend_input>text</frontend_input>
            <frontend_label>Strategy</frontend_label>
            <is_required>1</is_required>
            <default_value xsi:type="string">link text</default_value>
            <source>Magento\Mtf\Test\Fixture\Test\Strategy</source>
        </field>
        <field name="search">
            <attribute_code>search</attribute_code>
        </field>
        <field name="type">
            <attribute_code>type</attribute_code>
        </field>
    </fields>
    <repository_class>Magento\Mtf\Test\Repository\Test</repository_class>
    <handler_interface>Magento\Mtf\Test\Handler\Test\TestInterface</handler_interface>
</fixture>
